review_id,company_name,industry,job_title,review_date,overall_rating,pros_text,cons_text
1104,GSK,Healthcare,Senior manager,2025-08-20,4.0,Good work life balance Good benefits,too much outsourcing not much growth opportunity in Europe or North America
1105,Boston Scientific,Healthcare,Clinical specialist,2025-06-24,5.0,love it and will never change,not enough inventory but it's okay
1106,Roche,Healthcare,Scientific partner,2025-04-24,5.0,"Great Benefits, Friendly Colleagues, Exciting work",Very siloed between global and the affiliate.
1107,Roche,Healthcare,Applications engineer,2025-08-10,4.0,"Work from Home, so you can make your own schedule and work load when necessary.","When no work is available or needed, its fawned upon to be home doing administration work. You should call you RSM to see who needs help and travel out of your territory to do their work."
1108,Roche,Healthcare,Senior medical director,2025-07-17,4.0,Great culture and fun people to be around,Constant transformation and job security
1109,Johnson & Johnson,Healthcare,Marketing intern,2025-10-15,5.0,Great benefits and great company to work for,I don't have any cons
1110,GSK,Healthcare,Senior sales specialist,2025-03-09,3.0,lots of tenured good people,"primary care mentmentality in specialty and oncology, all about KPI's, reactive not proactive."
1111,Pfizer,Healthcare,Health and science specialist,2025-10-21,5.0,Great company - excellent benefits,No cons to report at the moment
1112,Boston Scientific,Healthcare,Senior financial analyst,2025-10-29,2.0,Great pay and some solid benefits,"Culture differs from team to team, really need to improving training method or documentation. Can get crazy workload from the jump and then get minimal support."
1113,Johnson & Johnson,Healthcare,Supply chain co-op,2025-10-15,5.0,"Great educational and growth opportunities, fantastic people, great pay, one of a kind culture (in a good way)",Can be hard to find a full-time job after a co-op
1114,Boston Scientific,Healthcare,Process engineer i,2025-08-18,5.0,Supportive culture and overall great company,Honestly nothing bad to report so far
1115,Pfizer,Healthcare,Senior level,2025-04-29,2.0,"Big company’s benefits, infrastructure, nice campus and facilities","Key focus areas include financial gain and short-term objectives, with a lack of emphasis on long-term strategies and insufficient expertise in discovery and development. The business model relies heavily on licensing agreements. Consequently, the organization undergoes frequent reorganizations and layoffs, and struggles with competency gaps. Management appointments are often influenced by personal connections rather than merit. Ineffective people management, limited experience, and a lack of management training programs and growth opportunities are also evident. Moreover, favoritism and discrimination against non-Asian nationalities are significant concerns."
1116,Mayo Clinic,Healthcare,Postdoctoral research associate,2025-06-24,5.0,"Prestigious Institution: Internationally recognized for medical excellence and innovation, Mayo Clinic adds strong credibility to your CV. Access to Clinical Data: Unique opportunity to work with high-quality, de-identified patient data, especially beneficial for researchers in AI, imaging, or bioinformatics. Collaborative Environment: Interdisciplinary culture encourages collaboration between clinicians, scientists, and engineers. Strong Research Infrastructure: Robust support systems, including access to biostatistics, IRB assistance, research computing, and administrative support. Focus on Translational Impact: Projects are often clinically relevant and aimed at real-world implementation, which is rewarding for applied researchers. Internal Funding Opportunities: Postdocs can apply for intramural seed grants and are often encouraged to submit K99/R00 or equivalent career development awards. Excellent Work-Life Balance: Compared to other high-pressure research institutions, Mayo often promotes a healthier and more humane research culture.","Limited Academic Networking: Rochester and Phoenix campuses can feel geographically isolated from larger academic ecosystems, which may limit seminar diversity or visiting speaker series. Variable PI Mentorship: Experience heavily depends on your mentor. Some labs offer strong guidance and career development; others are more hands-off. Transition to Faculty May Be Limited: Few internal postdocs are promoted directly to faculty roles; career progression often requires moving institutions. Bureaucracy: As a large healthcare organization, navigating institutional policies, compliance, and data access protocols can be slow and frustrating. Salary Considerations: While above NIH minimums, compensation may still lag behind tech industry roles or more competitive postdoc positions in industry-aligned labs."
1117,GSK,Healthcare,Team leader,2025-06-26,5.0,"Great work life balance, culture, passion, and talented people.",Too much to do with not enough resource.
1118,GSK,Healthcare,Senior scientist,2025-07-31,3.0,Generally helpful people and very strong technical SMEs to learn from,"Not transparent about management, promotions etc. can be quite tribal. lot of groupism to navigate"
1119,Roche,Healthcare,Project manager,2025-07-13,5.0,Great benefits and good teams.,Bureaucracy can get in the way of progress sometimes.
1120,Roche,Healthcare,Sales,2025-03-25,5.0,Great people to work with,I have no cons to mention
1121,Roche,Healthcare,Anonymous employee,2025-03-11,4.0,"Good benefits package overall, you hire in with 3 weeks vacation.",Work-life balance can be challenging at times.
1122,GSK,Healthcare,Scientist,2025-08-27,4.0,"Fair compensation, culture is great in the workplace",Expect to work on after hours on weekdays
1123,Roche,Healthcare,Field operations,2025-08-14,4.0,Great company but not enough new products,Stock price is suffering and hence little equity return
1124,Johnson & Johnson,Healthcare,Marketing intern,2025-10-15,5.0,Great benefits and great company to work for,I don't have any cons
1125,Roche,Healthcare,Project manager,2025-08-11,4.0,Good team supportive leadership innovative,"work life balance, high pressure"
1126,Johnson & Johnson,Healthcare,Coop student,2025-09-22,5.0,Could not have had better people,"Less pay 
Less benefits 
Nothing else"
1127,GSK,Healthcare,Manager,2025-07-08,4.0,Great benefits and development opportunities,"Slow decision making, difficult to advance in role"
1128,Mayo Clinic,Healthcare,Certified registered central service technician,2025-08-14,4.0,"Pay, cafeteria, free uniforms, okay PTO","Poor environment, physical labor, managers don’t care"
1129,Pfizer,Healthcare,Sales representative,2025-10-01,4.0,Great benefits and small territory,Micromanaging from above. No insurance coverage.
1130,Mayo Clinic,Healthcare,Patient access specialist,2025-07-16,4.0,"Pay is relatively competitive, room to advance within the company.",There's such a communication/expectation disconnect from upper management to staff actually doing the job. They'll add on more work without increasing pay. High turnover often has to do with upper management/admin and not the actual work.
1131,Roche,Healthcare,Scientist,2025-05-31,4.0,Healthy working environment and team engagement.,Slow career progression; not a lot of career planning support.
1132,Pfizer,Healthcare,Ehs specialist,2025-10-01,3.0,"Benefits, coworkers, facilities are being upgraded.","Salary below industry average, work-life balance, ability to facilitate change, facilities are old and at least a decade overdue for renovation, communication from management, employee morale."
1133,Roche,Healthcare,Investigator,2025-09-03,4.0,"Benefits, Diversity, Cafeteria, Growth, Opportunities","Low pay, Location, Open office space concept,"
1134,Roche,Healthcare,Security affiliate manager,2025-04-15,3.0,Great healthcare benefits and good work life balance,Resourcing in the us is not valued
1135,Pfizer,Healthcare,Anonymous employee,2025-05-09,2.0,If you have a good manager it can be great. You can jump from role to role easily if they like you.,"- Pfizer’s acquisition of Seagen destroyed the great culture we had in Bothell. - Pfizer’s culture is a popularity contest, especially in the New York scene. They admit as much in department meetings. They'll keep bringing back people they laid off if they like them, despite incompetence or job qualifications. - I've never had a more toxic manager or experience than at Pfizer. If the manager doesn't like you or doesn't want to hear your ideas, the accepted culture is to quiet fire people until they leave. (So I left, rather than be treated like garbage.) - They want robots to follow orders, no creative or innovative ideas welcome. They hide their true intentions under a disguise of being collaborative. - toxic leadership is encouraged to be as such and defended by HR"
1136,Pfizer,Healthcare,Programmer/analyst,2025-09-14,5.0,supportive and a growth culture,I hardly found one as is platform with peer contributions and work support.
1137,Johnson & Johnson,Healthcare,Sales consultant,2025-10-05,5.0,great benefits and take care of employees,hard work life balance at times
1138,GSK,Healthcare,Investigator,2025-08-13,4.0,Decent pay. Excellent benefits and vacation. They also do a week shutdown from Christmas through the New Year.,"The open office is nearly impossible to work in. The open laboratory looks state of the art, but the buildings are overcrowded."
1139,GSK,Healthcare,Senior scientist,2025-06-20,3.0,People I work with are supportive and easy to get along with. Some opportunities for development. Retirement program is excellent. Exceptional work life balance.,Pay is mediocre at best. Opportunities for promotion are almost non-existent.
1140,Boston Scientific,Healthcare,Product builder i,2025-09-21,3.0,"not too hard to learn
only required GED","supervisor has favorite
Management do not care about you"
1141,Johnson & Johnson,Healthcare,Director,2025-10-08,2.0,"It was a great company, with amazing collaborative culture, slow growth but benefits and work life balance, from tuition reimbursements, gym to childcare facilities, if you go above and beyond you might not be promoted but were given stocks even at managerial level. There were preferences for internal candidates, folks felt like home until Covid hit and Joaquin became the new CEO","Today this is any other company after almost a decade, feel sad that I called it home, if you are a women or a women of color this isn’t the place anymore, credo discussions and patient focus is just a facade it’s all about numbers and wall street, folks who are lifers are also treated like nobody, Folks who are good at managing up are the ones you can make the cut, some folks who hide and do nothing keep on staying and the high performers are sidelined or let go. HR partners are of no use, they want people to leave as attrition is still low! They want to hire externally, more European leaders at the top?"
1142,Johnson & Johnson,Healthcare,Clinical account specialist,2025-09-22,5.0,"Small territories, great benefits, engaging work.",Last to PFA market having to play catch up
1143,GSK,Healthcare,Product manager,2025-04-11,4.0,"A positive work environment, supporting collaboration.",There are limited internal growth opportunities.
1144,GSK,Healthcare,Research associate,2025-06-08,4.0,Good culture and very good work-life balance.,HR part of the company is slow.
1145,Roche,Healthcare,Scientist,2025-05-31,4.0,Healthy working environment and team engagement.,Slow career progression; not a lot of career planning support.
1146,Pfizer,Healthcare,Anonymous employee,2025-07-22,4.0,Great colleagues and opportunities. Care very much about the work they provide.,No thoughts come to my mind.
1147,Johnson & Johnson,Healthcare,Senior software egnieer,2025-10-02,5.0,"benefits, culture, cool tech and work life balance",deadlines could be tight sometimes
1148,Boston Scientific,Healthcare,Process engineer i,2025-08-18,5.0,Supportive culture and overall great company,Honestly nothing bad to report so far
1149,Roche,Healthcare,Field engineer,2025-04-22,5.0,"Management is spectacular, great benefits, amazing clients",Extensive territory so lots of driving
1150,Boston Scientific,Healthcare,Senior clinical specialist,2025-07-26,4.0,The products are excellent and they sell themselves/ the sales training team arms you with the necessary materials to succeed,"Retention is terrible because leadership is disconnected from the field and punishes its hardest workers with more hard work. There is a lack of opportunity to make more money and so there is a tendency to see burnout right before someone reaches the end of their contract. When presented with a new contract opportunity, there is no offer to raise the base salary."
1151,Boston Scientific,Healthcare,Product builder,2025-06-16,5.0,"Supportive team, clean environment, great benefits, good training, flexible hours.","Sometimes repetitive tasks, limited advancement opportunities, weekend shifts required occasionally."
1152,Boston Scientific,Healthcare,Co-op,2025-10-16,5.0,nice people to work with,"busy, is stress at times"
1153,Mayo Clinic,Healthcare,Anonymous employee,2025-06-03,2.0,"- A lot of flexibility - Good base pay - A lot of prestige attached to your resume - Once upon a time there was a great mission, hoping it comes back","Joining this organization came with significant excitement. Its stellar reputation and compelling mission were incredibly appealing, and I even accepted a lower total compensation package, driven by the prospect of contributing to a positive societal impact. I truly believed I could make a difference here. However, my actual experience has been quite different from those initial hopes. I work within an area often described as a ""platform,"" which initially seemed poised to be the future of healthcare, with the potential to dramatically improve patient outcomes. Unfortunately, this vision remains largely unrealized. Much of this can be attributed to the leadership at various levels, especially with the Mayo CEO and COO of my group. There's a palpable sense of internal pressure that often feels artificial, contributing to a generally difficult work environment. The organizational culture, at least within my domain, appears to be heavily influenced by fear, where deference to the COOs authority is often rewarded over contributions. Challenging the status quo, even when justified, will carry significant repercussions. This is particularly problematic when valid points are raised, as they can be perceived as threats by those in leadership positions. For example, there's a clear lack of strategic direction, evident in the sheer number of ""priorities"" that are simultaneously juggled – it's difficult to see how the 70th item on a list can genuinely be considered a priority. This highlights a significant disconnect in setting and executing clear objectives. While there are some talented individuals in leadership roles, it feels like many struggle to effectively manage upward when faced with less competent authority. Having worked in tech, I believe many of these leaders would be eaten up by standard directors at most tech companies. To focus a bit more on the COO, it's apparent to all that he has limited operational knowledge and seems to have achieved their position through aggressive interpersonal dynamics. He consistently undermines colleagues in public discussions. What follows is typically a frustrating cycle of criticism without any practical advice, leaving teams without a clear path forward. He is consistently proven wrong, but feels like he is either too dense to acknowledge he was wrong or has made a career of just continuing to belittle people in the hope they do not dare call him on it. Despite these challenges, there are truly exceptional individuals within the organization, particularly among the doctors working with the ""platform."" Interacting with the doctors has been inspiring, and their dedication is undeniable. My only observation is a desire for stronger advocacy from them against operational inefficiencies, especially concerning the COO, who lacks both relevant medical and technical expertise. Overall, I'm give this organization a 2-star rating. My respect for many of the individuals here, especially the medical professionals, and the inherent potential of the mission keep it from being a 1. However, for those in non-medical roles (or medical roles but devote most of their time to this team), the experience will be frustrating. There's a possibility for significant improvement, particularly with future leadership changes, but whether it's worth waiting to see that unfold, or joining before such changes occur, is a significant consideration."
1154,GSK,Healthcare,Senior qc analyst,2025-11-02,4.0,"Best benefits, lot of learning opportunities",Nothing to say about it
1155,Roche,Healthcare,Global d&i manager,2025-11-07,5.0,Amazing 401k match plus more.,You have to be willing to relocate to Switzerland to be successful as you continue to advance past the Sr. Manager level.
1156,Pfizer,Healthcare,Senior manager data analyst,2025-08-25,4.0,hybrid work week and a nice team,initial training was lacking on most jobs
1157,GSK,Healthcare,Local delivery lead,2025-03-10,5.0,Great company culture especially for working parents. Incredible maternity and paternity leave. Family first mentality. Lots of opportunities for personal development and advancement,Change is almost constant. GSK values continuous improvement but the changes are so frequent it's hard to adapt and perform day to day work when you're constantly having to learn new platforms and processes.
1158,Boston Scientific,Healthcare,Manufacturing engineer i,2025-10-09,3.0,Good training and support systems.,Advancement will be slow. Expect to spend 3 to 4 years with no title change and very little salary growth
1159,GSK,Healthcare,Scientific leader,2025-10-29,5.0,Great Company to work for,I do not have anything negative to say.
1160,Pfizer,Healthcare,Sales,2025-10-29,4.0,Solid company Great opportunities. Lots of experienced people to learn from.,Very large. Get lost easy
1161,GSK,Healthcare,Manager,2025-04-09,3.0,"Benefits including medical, 401k and time off. Good salary.",Toxic workplace. Employee Evaluations included wording on how an individual was performing relative to their peers such as at a level above or at a level below.
1162,GSK,Healthcare,Associate director,2025-03-14,5.0,"Benefits, work life balance, pay",Return to work police not aligned with organization and travel limitations
1163,Boston Scientific,Healthcare,Human resources,2025-01-23,4.0,Benefits Pto’s Perks 401k ESOP Daycare,"this is the most toxic workplace. Reeks of passive aggressive attitudes and entitled tenured grandpas and grandmas. Peers seem friendly but are manipulative, and petty. Some despite’ being tenured are clueless on company policies and “director “ titles make up for the sheer ignorance. Being in a people driven role, you are treated badly by internal leadership and employees, on certain situations. Leaders are reactive versus being mature. The benchmarking and data belongs to the 18th century and somehow is never competitive or accurate. Everyone is seemingly a part of project but outcomes are never tangible. TA onboarding operations all play to their own tunes and everyone seems disconnected."
1164,Pfizer,Healthcare,Product manager,2025-07-30,4.0,Smart coworkers who are passionate about what they do,Constant reorgs and prioritization exercises
1165,Johnson & Johnson,Healthcare,Case manager,2025-08-08,2.0,Great benefits. They have great policies and procedures.,Poor management in the PSC Johnson & Johnson. They have no knowledge on how to run a pharmacy hub. They are unorganized and they throw unrealistic work on the employees. People call out every day due to the stress from management. They don’t investigate or hold leadership accountable. Disability employees are not respected and denied resources to allow them to be successful. Not an equal opportunity work place
1166,Pfizer,Healthcare,Sales,2025-10-29,4.0,Solid company Great opportunities. Lots of experienced people to learn from.,Very large. Get lost easy
1167,Johnson & Johnson,Healthcare,Sound engineer,2025-10-01,4.0,Good Support Intent Review Control,Persistent Demanding Heavy Hourly Full time
1168,Boston Scientific,Healthcare,Senior financial analyst,2025-06-23,4.0,Work Life Balance Compensation Interesting Work Company Mission Company Leadership,Opportunities for Advancement are lacking
1169,Pfizer,Healthcare,Sr. director,2025-11-17,3.0,Great long term benefits if you have been here for over 15 years. Great work life balance.,"There is absolutely zero reason for joining this company. None. Unless you want the brand on your resume. Constant reorg, and I mean constant. On average, have had a new division lead every 12 months. Operational model keeps changing. Stock goes nowhere but south. People with no business leading people are made senior leaders, Others are let go, both with little advance notice."
1170,Roche,Healthcare,Staff software engineer,2025-05-30,3.0,Long term projects and benefits were good,nothing specific to mention in my personal experience
1171,Roche,Healthcare,Cyber security sme,2024-01-11,2.0,The benefits were awesome. I used the maternity leave and I really appreciated being out for 12 weeks instead of the traditional 6 weeks. I'm guessing this is because they are not a U.S. originated company. I also had the opportunity to work with really smart people.,"My manager was a Shared Services manager with no concept of IT or Security so she was not able to give me the support I needed to understand and collaborate on my role responsibilities. As a result, she managed based on meaningless tasks and how many hours she could get me to spend on them. She didn't understand that 10+ programs was too many for 1 person to fully understand, and maintain. Security was not centralized within the company so different departments were doing different things with no collaboration. Security was not taken seriously. Managers wanted to do the least and have me sign off on whatever. I had numerous privacy concerns that were part of their minimum security requirements that were not addressed. The company hasn't adopted a framework they plan to stick to. Overall, I felt like the fall person for when they eventually have a major breach or fall out with some privacy law like GDPR."
1172,Roche,Healthcare,Anonymous employee,2025-03-11,4.0,"Good benefits package overall, you hire in with 3 weeks vacation.",Work-life balance can be challenging at times.
1173,Pfizer,Healthcare,Sales representative,2025-10-06,3.0,Freedom to control daily activity,Not competing salary and bonus
1174,Mayo Clinic,Healthcare,Nurse,2025-09-22,4.0,Great place to gain experience as an already established RN.,"There are soooo many support teams there, which is wonderful, until you leave and get thrown back into real life nursing."
1175,Pfizer,Healthcare,Anonymous employee,2025-07-21,5.0,great place to work to make vaccines,Not that I know of
1176,Roche,Healthcare,Research scientist,2025-10-14,5.0,"WLB, good science, great location, good people","Not well run, too many projects"
1177,Mayo Clinic,Healthcare,Clinical specialty representative,2025-10-06,4.0,Benefits are good & corporate culture,healthcare insurance limited outside Rochester limited resources
1178,Johnson & Johnson,Healthcare,Gold associate,2025-10-01,4.0,- Opportunity to expereince three new jobs and network across the company,- Have to move around every 9 months
1179,Pfizer,Healthcare,Senior level,2025-04-29,2.0,"Big company’s benefits, infrastructure, nice campus and facilities","Key focus areas include financial gain and short-term objectives, with a lack of emphasis on long-term strategies and insufficient expertise in discovery and development. The business model relies heavily on licensing agreements. Consequently, the organization undergoes frequent reorganizations and layoffs, and struggles with competency gaps. Management appointments are often influenced by personal connections rather than merit. Ineffective people management, limited experience, and a lack of management training programs and growth opportunities are also evident. Moreover, favoritism and discrimination against non-Asian nationalities are significant concerns."
1180,Boston Scientific,Healthcare,Scrum master,2025-07-23,5.0,This industry has been stable where other industries right now are experiencing layoffs. Great work life balance. You can take ownership of your career and upskill to get positions that accelerate your career growth.,Base Pay not as competitive as other companies. Not as many perks like RSUs or free food.
1181,Mayo Clinic,Healthcare,Resident physician,2025-10-02,5.0,Nice work environment and great people,Location is peaceful but as much to do as big cities
1182,Mayo Clinic,Healthcare,Senior program coordinator,2025-06-25,4.0,"Mayo Clinic is a great institution to gain knowledge of clinical research. This position exposes you to many different industries and tasks that overall, make you a better research manager",Lacks a clear pathway for promotion.
1183,Johnson & Johnson,Healthcare,Account manager,2025-10-29,5.0,"Great culture, benefits, and pay",No negative things to say
1184,Pfizer,Healthcare,Marketing director,2025-09-03,3.0,"Autonomy
Great work life balance","Frequent layoffs
Limited opportunities to advance"
1185,Pfizer,Healthcare,Ehs specialist,2025-10-01,3.0,"Benefits, coworkers, facilities are being upgraded.","Salary below industry average, work-life balance, ability to facilitate change, facilities are old and at least a decade overdue for renovation, communication from management, employee morale."
