review_id,company_name,industry,job_title,review_date,overall_rating,pros_text,cons_text
366,Roche,Healthcare,Senior project manager,2025-03-02,4.0,It's an excellent place to learn. Great travel opportunities. Bonuses can easily exceed the target if the company has a good year. Good stability and work/life balance. Awesome health insurance and other benefits.,"The PM role is more administrative than leading, and it shows. Easy to be pigeonholed, as roles are highly specialized. For the same reason, it can be hard to grow. The usual office politics, though not as bad compared to other places."
367,Roche,Healthcare,National business manager,2025-05-09,5.0,"The product portfolio is strong, opportunities to move cross-franchise and BU afford upward mobility to those who are driven, well networked, and successful. Great organization, excellent benefits.",Pay is at the median for the industry.
368,Roche,Healthcare,Staff software engineer,2025-05-30,3.0,Long term projects and benefits were good,nothing specific to mention in my personal experience
369,Roche,Healthcare,Scientist,2025-05-31,4.0,Healthy working environment and team engagement.,Slow career progression; not a lot of career planning support.
370,Roche,Healthcare,Associate scientist,2025-05-28,5.0,Great work life balance. Good people. Good management.,Pay could be better but wasn’t bad.
371,Roche,Healthcare,Associate scientist,2025-05-28,5.0,Great work life balance. Good people. Good management.,Pay could be better but wasn’t bad.
372,Roche,Healthcare,Field service engineer,2025-05-28,3.0,"Benefits, pay, co-workers are nice and helpfull.","no work-life balance, a lot of overtime."
373,Roche,Healthcare,Director,2025-04-30,5.0,Given freedom to do my job. Well supported.,Sometimes change slow to occur.
374,Roche,Healthcare,Anonymous employee,2025-06-26,1.0,"None, absolute nightmare. Please beware.",Beware this company! A complete nightmare!
375,Roche,Healthcare,Senior manager,2025-02-02,5.0,I worked in 5 different areas and everyone was passionate about what they do! Great benefits and great work/life balance. Best company I have ever worked for (in my 35 years in the work world),--Lots of reorganizations in the last 4 years creating uncertainty and confusion --Change for change's sake - needs to be more thoughtful --Too much reliance on temporary workers
376,Roche,Healthcare,Associate scientist,2025-05-15,3.0,"Great campus, well resourced for employees.",Primarily contract to hire as their expansion strategy.
377,Roche,Healthcare,Anonymous employee,2025-05-09,5.0,good pay and big name,bad work life balance and a lot of travel
378,Roche,Healthcare,Delivery manager,2025-05-12,3.0,"Flex Work Options
Remote work","Micromanagement
Hard to change the department without manager approval"
379,Roche,Healthcare,Business analyst,2025-03-23,3.0,"Being a European company, the culture is decent, with immediate managers being nice","Mid-level management has let the waves steer the ship, with no sense of direction, or taking the blame for the state of things"
380,Roche,Healthcare,Ai internships,2025-04-11,5.0,"friendly environment, edge of technology R&D, publication and patent opportunity as an intern, beautiful campus",Nothing specific that comes to my mind
381,Roche,Healthcare,Senior scientist,2025-04-17,5.0,Very open and supportive environment,Too many departments to juggle with to get things done sometimes
382,Roche,Healthcare,Scientific partner,2025-04-24,5.0,"Great Benefits, Friendly Colleagues, Exciting work",Very siloed between global and the affiliate.
383,Roche,Healthcare,Sales representative,2025-03-14,4.0,"Roche Diagnostics offers competitive salaries and comprehensive benefits, including health insurance, retirement plans, and employee wellness programs.","Roche Diagnostics can be highly bureaucratic, making decision-making processes slow and rigid. Also very siloed between divisions"
384,Roche,Healthcare,Rfp coordinator,2025-04-15,5.0,Great company to work for Company with a positive impact Well managed Good culture,"None, don’t have any negative feedback"
385,Roche,Healthcare,Field engineering specialist,2025-04-22,5.0,Great co workers and drive to perform,Management can be a bit backwords on promises
386,Roche,Healthcare,Field engineer,2025-04-22,5.0,"Management is spectacular, great benefits, amazing clients",Extensive territory so lots of driving
387,Roche,Healthcare,Molecular diagnostic technician,2025-04-15,3.0,"Good benefits, friendly co-workers, same hours each week","Favoritism, work gets repetitive and can be boring, communication is lacking"
388,Roche,Healthcare,Security affiliate manager,2025-04-15,3.0,Great healthcare benefits and good work life balance,Resourcing in the us is not valued
389,Roche,Healthcare,Digital business manager,2025-03-17,3.0,Excellent company with real good benefits and a positive work/life balance,Some teams are kind of lost in the strategy. Leadership in digital is a complete joke.
390,Roche,Healthcare,Executive director,2025-02-14,3.0,Incredible people. They were the leaders in oncology and benefitted greatly from being a top place to work.,Chaotic and overly complex. They seem to have lost focus and have too many inexperienced leaders trying to navigate through the large global pharma and dia businesses. It's probably going to be a few years before things are good again and their back on track.
391,Roche,Healthcare,Senior scientist,2025-03-25,3.0,Good benefits and insurance plans Good people culture Resourceful Flexible,Too political Instability- leading to large layoffs A lot of projects get cancelled or 'paused' Frequent organizational restructuring
392,Roche,Healthcare,Anonymous employee,2025-03-20,4.0,"my boss, team, and the ex-Roche network",Those who play the Roche game are the ones who last the longest
393,Roche,Healthcare,"Director, engineering",2025-03-12,4.0,"Favorable work environment, salary and benefits",Decision by committee delays ability to be competitive.
394,Roche,Healthcare,Sales,2025-03-25,5.0,Great people to work with,I have no cons to mention
395,Roche,Healthcare,Principal engineer ii,2025-03-18,5.0,Good work life balance. A lot of exciting projects.,almost annual layoff in recent 4 years.
396,Roche,Healthcare,Senior software engineer,2025-03-18,5.0,"Good Work Life Balance
latest technologies",Slow paced work style takes forever to make a decison
397,Roche,Healthcare,Cyber security sme,2024-01-11,2.0,The benefits were awesome. I used the maternity leave and I really appreciated being out for 12 weeks instead of the traditional 6 weeks. I'm guessing this is because they are not a U.S. originated company. I also had the opportunity to work with really smart people.,"My manager was a Shared Services manager with no concept of IT or Security so she was not able to give me the support I needed to understand and collaborate on my role responsibilities. As a result, she managed based on meaningless tasks and how many hours she could get me to spend on them. She didn't understand that 10+ programs was too many for 1 person to fully understand, and maintain. Security was not centralized within the company so different departments were doing different things with no collaboration. Security was not taken seriously. Managers wanted to do the least and have me sign off on whatever. I had numerous privacy concerns that were part of their minimum security requirements that were not addressed. The company hasn't adopted a framework they plan to stick to. Overall, I felt like the fall person for when they eventually have a major breach or fall out with some privacy law like GDPR."
398,Roche,Healthcare,Anonymous employee,2025-02-26,5.0,"Supportive, collaborative, and creative environment.","Multinational organization, so there are sometimes early calls to accommodate different time zones. Not a problem if you are okay with early or late calls."
399,Roche,Healthcare,Anonymous employee,2025-03-11,4.0,"Good benefits package overall, you hire in with 3 weeks vacation.",Work-life balance can be challenging at times.
400,Roche,Healthcare,Anonymous employee,2025-03-08,4.0,"Benefits, salary, hybrid, on site clinic and gym",Too many processes and other depts aren't held to hybrid work schedule.
401,GSK,Healthcare,Scientific leader,2025-10-29,5.0,Great Company to work for,I do not have anything negative to say.
402,GSK,Healthcare,Associate scientist,2025-10-11,1.0,Nothing other than the benefits,"I worked in the physciochem department in Cambridge Massachusetts and it was one of the most toxic environments I’ve ever experienced. There’s a clear pattern of favoritism and racial bias — white colleagues were promoted within months, while others were overlooked repeatedly regardless of performance or qualifications. When I was approved for a secondment opportunity, my department in Cambridge refused to release me, only to ask me later to find my own replacement. After I did, they delayed interviewing the candidate until my secondment opportunity had expired — and then hired that same person into my old role. Despite consistently meeting expectations, I received a poor performance review for reasons unrelated to my work, such as “not being in the lab enough,” even though management itself failed to provide direction or support. This department operates with poor leadership, zero accountability, and a culture that damages mental health. If you value fairness, growth, and respect, stay away."
403,GSK,Healthcare,Senior qc analyst,2025-11-02,4.0,"Best benefits, lot of learning opportunities",Nothing to say about it
404,GSK,Healthcare,Laboratory technician,2025-10-27,3.0,"Great hours, good pay & 2 week shutdown for Christmas",No career advancement unless you’re part of the “good old boys club”
405,GSK,Healthcare,Sr. director,2025-10-29,4.0,Average experience for pharma R&D job,no real negatives here at company
406,GSK,Healthcare,Operations,2025-10-20,3.0,Entry level pay Excellent benefits Bright future,Management favoritism. Some departments require you to do more then your job title without extra pay(2 jobs for the price of 1)
407,GSK,Healthcare,Immunology sales specialist,2025-10-14,5.0,Love my team and manager. Genuinely helping patients,I love my job. No cons
408,GSK,Healthcare,Sales representative,2025-10-05,5.0,"Really great focus on development 
Work life balance","Not many to say, just want a manager who invests in you and your development"
409,GSK,Healthcare,Senior director,2025-07-27,2.0,Good International exposure and opportunity to move around into different roles,I was treated absolutely horribly through an HR process at the end of my time there and ultimately decided to leave. They use the typical line that everything is being done equitably but everyone knows that it is not. I even made a complaint to HR and ultimately nothing was done. I decided to leave the company after that and it was the best decision I ever made. They really don’t treat their people well when it comes to HR processes.
410,GSK,Healthcare,Software engineer,2025-09-25,4.0,"Deadlines are reasonable, good colleagues, hybrid work schedule",Cafeteria is meh. Upper Providence is a little far from Philadelphia so commute is a bit annoying if you don't live near the site.
411,GSK,Healthcare,Sales representative,2025-10-05,5.0,"Really great focus on development 
Work life balance","Not many to say, just want a manager who invests in you and your development"
412,GSK,Healthcare,Senior director,2025-07-27,2.0,Good International exposure and opportunity to move around into different roles,I was treated absolutely horribly through an HR process at the end of my time there and ultimately decided to leave. They use the typical line that everything is being done equitably but everyone knows that it is not. I even made a complaint to HR and ultimately nothing was done. I decided to leave the company after that and it was the best decision I ever made. They really don’t treat their people well when it comes to HR processes.
413,GSK,Healthcare,Director,2025-08-09,5.0,Positive purpose-driven company Generous compensation Flexible yet fast-paced working environment,"Recently went through a restructuring that moved many U.S.-based roles to India and the UK, while outsourcing hundreds of tech positions from Poland to Accenture. Although exit compensation and benefits were provided, I had believed this was the place where I would spend the rest of my career. There also seem to be too many VP roles, with some overlapping and stumbling over each other due to unclear responsibilities."
414,GSK,Healthcare,Software engineer,2025-09-25,4.0,"Deadlines are reasonable, good colleagues, hybrid work schedule",Cafeteria is meh. Upper Providence is a little far from Philadelphia so commute is a bit annoying if you don't live near the site.
415,GSK,Healthcare,Mba intern,2025-09-30,4.0,Great culture and good company to work for,lack of incentives both monetary and advancement
416,GSK,Healthcare,Technical service representative,2025-08-01,2.0,"There is really only one pro and that is the compensation and benefits are decent, certainly not a leader in the field, but decent.","Where to begin... GSK as a company is an after thought among larger industry players, their pipeline is weak, they haven't experienced significant growth in decades, and recent acquisitions suggest poor purchases and capital allocation. Structurally, there is significant bureaucracy in this company that is a death knell to innovation and efficiencies, there are many layers of middle management with countless directors, associate managers, and other fancy sounding titles. I worked at for this company for many years and I still don't know what many of these positions did and many seemed either redundant or highly specialized. When it comes to hiring individuals, there seems to be an incredible lack of attention on meaningful skill and capabilities, and more emphasis on diversity and value... which frankly is so hypocritical because this company holds a record for one the largest fines in US history related to their marketing practices and integrity. Competitors seem to be bounding ahead and no one in the company that has any kind of important role seems to offer a strategy or solution. It becomes very tiresome to listen to these people talk, but never do. If you want an okay salary and you can be easily convinced of ""great things to come"", by all means give this company a go, but make sure to bring you Excedrin because you will quickly start wondering how any of the people running this circus got their roles. If you do happen to end up working for this company, you will probably have two possible career paths. The most likely is a string of rejections, failed attempts, and being told how important you are without ever advancing. The less likely path is that the cohort of dunderheads see themselves in you, salute your perceived greatness, and usher you into their special club of world-changing disrupters that benefit from titles, but not brains. This company is so built on a foundation of nonsense that it will either implode or languish against its peers for future decades. If you end up working here, it will likely be just a job and not a career. You have yourself to blame if you choose to work here."
417,GSK,Healthcare,Finance manager,2025-10-01,3.0,Good teamwork and interesting work,A lot of changes and reorganization
418,GSK,Healthcare,Backend developer,2025-09-26,5.0,"Everything was good, it was remote role","No cons, all good. The management and my manager was really helpful"
419,GSK,Healthcare,Executive director,2025-08-20,3.0,"Excellent people, most of them in mid management Beautiful offices They care about patients",Senior leadership wants to keep everything the same Company ruled completely by London chiefs who just want to blend in. Very passive agressive and not supportive of the US business
420,GSK,Healthcare,Principal scientist,2025-09-19,4.0,Decent pay | Good company culture | Good work-life balance | Great impact,Limited room for career growth
421,GSK,Healthcare,Principal scientist,2025-09-07,5.0,People I work with are amazing and I would highly recommend understanding that more than the science,Compensation and other benefits aren't the best
422,GSK,Healthcare,Sales representative,2025-09-14,2.0,Good meds to promote to customers,"Under value employees, advancement not based on merit, leadership disconnected from field"
423,GSK,Healthcare,Assistant scientist,2025-08-31,2.0,"Having a job. But if I could go back in time, I would not have taken this job.",Difficult personalities make working in the lab extremely difficult. I hated this job.
424,GSK,Healthcare,Investigator,2025-08-13,4.0,Decent pay. Excellent benefits and vacation. They also do a week shutdown from Christmas through the New Year.,"The open office is nearly impossible to work in. The open laboratory looks state of the art, but the buildings are overcrowded."
425,GSK,Healthcare,Specialist,2025-09-04,4.0,Good people and Good leadership,"Constantly changing direction, not enough time for previous plans to come to fruition."
426,GSK,Healthcare,Sr. principal scientist,2025-08-18,4.0,Great company culture with flexible on-site policy Great health insurance benefits Competitive pay for the state and area Excellent parental benefits,Two layoffs in R&D in two years but much of the pharma industry currently is suffering similar events
427,GSK,Healthcare,Associate scientist,2025-05-24,2.0,"As a global corporation, there is a wide network of people and resources to access for biotech needs (e.g. sterility assurance specialists, material science experts, quality assurance oversight, etc.). Typically, money and/or budgets are not a huge concern either.","Despite GSK's large network, it is remarkably disorganized and chaotic. Leadership frequently makes decisions/plans and then changes said plans within a few months. Employees have to regularly pivot with all the changes and have little to no say about the changes."
428,GSK,Healthcare,Junior engineering specialist co-op,2025-09-03,4.0,Exposure to a lot of different teams.,Difficulty finding entry level roles.
429,GSK,Healthcare,Scientist,2025-08-27,4.0,"Fair compensation, culture is great in the workplace",Expect to work on after hours on weekdays
430,GSK,Healthcare,Senior hr consultant,2025-07-12,4.0,The pros was the ability to take on project and temporary assignments. It allowed me to broaden and deepen my HR development.,"At times, certain employees are allowed to stay in roles - even if it clear that they lack social or emotional intelligence to serve customers with excellence."
431,GSK,Healthcare,Associate scientist,2025-05-24,2.0,"As a global corporation, there is a wide network of people and resources to access for biotech needs (e.g. sterility assurance specialists, material science experts, quality assurance oversight, etc.). Typically, money and/or budgets are not a huge concern either.","Despite GSK's large network, it is remarkably disorganized and chaotic. Leadership frequently makes decisions/plans and then changes said plans within a few months. Employees have to regularly pivot with all the changes and have little to no say about the changes."
432,GSK,Healthcare,Scientist,2025-08-27,4.0,"Fair compensation, culture is great in the workplace",Expect to work on after hours on weekdays
433,GSK,Healthcare,Senior hr consultant,2025-07-12,4.0,The pros was the ability to take on project and temporary assignments. It allowed me to broaden and deepen my HR development.,"At times, certain employees are allowed to stay in roles - even if it clear that they lack social or emotional intelligence to serve customers with excellence."
434,GSK,Healthcare,Automation engineer,2025-08-12,3.0,Slow paced Lots to learn experienced people,Slow paced not much change improvement culture could use work... For engineering there are no raises after you sign on just a COL adjustment every year.
435,GSK,Healthcare,Associate director,2025-08-20,4.0,Great culture and purpose. Vaccine division is fast pace and strives for innovation/drug development.,Company has been through several reorganization. Need to strengthen pipeline and output.
436,GSK,Healthcare,Executive director,2025-08-26,5.0,Flexible working arrangements. Relatively good total rewards package.,Low annual pay compared to peer companies.
437,GSK,Healthcare,Hr business partner,2025-08-28,3.0,Good pay within the HR function,nothing that I can think of at this time
438,GSK,Healthcare,Senior manager,2025-08-20,4.0,"Good work life balance
Good benefits","too much outsourcing
not much growth opportunity in Europe or North America"
439,GSK,Healthcare,Senior associate scientist,2025-08-17,3.0,"Good work life balance
Good team culture",Pays low compared to market
440,GSK,Healthcare,Senior scientist,2025-06-20,3.0,People I work with are supportive and easy to get along with. Some opportunities for development. Retirement program is excellent. Exceptional work life balance.,Pay is mediocre at best. Opportunities for promotion are almost non-existent.
441,GSK,Healthcare,Associate scientist,2025-04-28,4.0,"Great pay, flexible hours(hybrid can be allowed depending on role and manager), and overall great atmosphere. Site leaders definitely make great efforts to have community events that bring everyone together. They aren't given a ton to work with so they do a good job of creating a good work environment. My coworkers are great and the work we do is seen and acknowledged, and I'm able to see how my work is used down the line.",There's a lot of uncertainty with multiple reorganizations happening and higher-up leadership up and leaving. I haven't been affected but many around me have.
442,GSK,Healthcare,Sr cyber security consultant,2025-07-15,4.0,Couple of the folks were great,"Relocated and bought a home for the role. The role was relocated again after 5 months. I wasn't going to move my family again, so we parted ways."
443,GSK,Healthcare,Associate director,2025-04-21,5.0,"For the self initiated, this is a great place to start a career. You can truly direct your own growth, and opportunities exist. Truly global: it helps that they have experience in almost all therapeutic areas.","1) Decision making can take forever - many unnecessary processes and rigidity 2) At times too much emphasis is put on longevity of employees (in decision making) at the expense of talent/creativity, add to office politics driven by those who have been around forever. Some are there simply to get titles 3) Compensation in actual dollars (for US) may be lower than competitors."
444,GSK,Healthcare,Warehouse associate,2025-07-24,1.0,None. Its a terrible place to work.,"Low ball pay, toxic co workers,can't sit, bad benefits. Work you like a dog mentality. High turnover with verbally abusive team members."
445,GSK,Healthcare,Scientific student worker / co-op,2025-07-22,4.0,Friendly people and work environment,Supervisors often seemed too busy for interns
446,GSK,Healthcare,Assoc. director,2025-07-15,5.0,"Good Benefits
Diverse Culture
Stability",Lack of Skilled Management in the Site Leadership
447,GSK,Healthcare,Scientist,2025-07-19,5.0,Great experience! Would recommend to anyone else,No cons come to mind
448,GSK,Healthcare,Manager,2025-07-08,4.0,Great benefits and development opportunities,"Slow decision making, difficult to advance in role"
449,GSK,Healthcare,Marketing manager,2025-07-08,4.0,Supportive for stretch projects and assignments,Siloed at times across teams like
450,GSK,Healthcare,Senior director,2025-06-05,3.0,Good work environment for those who can be agile Nice compensation package,There have been 3 R&D SVPs in the past 5 years I have been with GSK Vaccines. Such turnaround is not good for company direction.
451,GSK,Healthcare,Team leader,2025-06-26,5.0,"Great work life balance, culture, passion, and talented people.",Too much to do with not enough resource.
452,GSK,Healthcare,Senior compliance specialist,2025-01-07,5.0,"Good work-life balance, friendly co-workers, great supervisor and upper management. Allowed to work from home 1 day per week. Fair pay and great benefits as Hamilton is a small branch of the much larger GSK company. Annual bonuses are awarded based on company performance, plus smaller merit bonuses are awarded throughout the year if earned. Strong employee recognition system. Incredible mountainous location for outdoor enthusiasts to enjoy.","Due to the company's policies regarding performance improvement, chronic underperformers are allowed to stay with the company for many years in some cases. People make the company, so getting rid of poor performers needs to be more of a priority. Additional vacation time is not awarded until an employee has been with the company for 10 years. An entire decade before offering a PTO bump is too long. 15 days per year is the standard vacation offering. This could be improved."
453,GSK,Healthcare,Plant utility technician,2025-04-11,3.0,Good benefits. Generous 401k contributions and match. Pleasant coworkers. Low stress. I think the overall standards of the company were higher than this particular location.,Lacking true local leadership. Stagnant. No one cared enough to try and make it better. It sucked the life out of good people and they moved on.
454,GSK,Healthcare,Director,2025-06-05,4.0,Benefits were good. Great people struggling to do their best in a challenging environment.,"Low to medium salary, somewhat toxic environment."
455,GSK,Healthcare,Study delivery associate,2025-05-24,2.0,The office was nice. A large majority of the people were extremely smart and friendly.,Several of the managers weren't interested in building people. There were cliques very much like high school.
456,GSK,Healthcare,Senior scientist,2025-06-09,4.0,"European company, range of benefits, flexible hours",Slowly and obviously taking on more corporate-focused regulations and removing employee perks
