review_id,company_name,industry,job_title,review_date,overall_rating,pros_text,cons_text
703,Pfizer,Healthcare,Associate scientist,2025-08-18,5.0,"Great work culture, friendly atmosphere. Benefits are great, different site events are fun and inclusive, there are opportunities for growth experiences, unlimited sick days for those in laboratory roles, clubs/organizations that promote community/personal development, new facilities, on-site gym ($15 per month),","Not organized/managers are not in sync with each other when department is bigger. Sometimes feels like youre being judged without people saying anything. (I.e - seeing you holding your bag and assuming you came in late, assigning you more tasks because they saw you talking to someone earlier, .etc). It might be because its such a friendly environment but departmental growth is easier if youre already friendly with management. Pfizer Fridays are in the summer (half days) but some departments just decide you cannot participate. Different cultures completely depending on what department you are in."
704,Pfizer,Healthcare,Senior administrative assistant,2025-10-13,4.0,My company was bought out by Pfizer so that sucked. Our company before the buy out in my opinion was better due to the amount of passion and work my company did. I really like the people and then work we stood for. I hoped Pfizer took us to the next level. I was only with Pfizer for 4 months after the merge so I can’t say anything for company.,It’s corporate so sometimes it can be hard to adapt
705,Pfizer,Healthcare,Bpt,2025-11-04,4.0,"pay, career advancement and placement.",Sometimes political but everyone can find a space for them.
706,Pfizer,Healthcare,Senior associate scientist,2025-11-06,3.0,"Collaborative departments, able to learn lot. Good exposure in cooperate pharma","Takes long for promotions even you prove yourself, difficult to crack politics."
707,Pfizer,Healthcare,Scientist,2025-11-07,3.0,"good systematic training, and WLB",limited career development and job stability
708,Pfizer,Healthcare,Internship,2025-11-08,4.0,"Pretty warm community. Competitive, but not toxic",Salaries are not the most competitive
709,Pfizer,Healthcare,Anonymous employee,2025-10-01,1.0,"Bothell's research leadership is passionate and fosters collaboration. The Pfizer acquisition brings deep expertise from other sites, efficient workflows capable of managing very high throughput, and the ability to attract experienced upper management and talent to modernize the Bothell site. New hire salary is generous.","Legacy Seagen talent left for Immunome. Many remaining have not worked elsewhere and are not familiar with practices standard across the industry. Sample traceability is poor, documentation is not standardized, training is not enforced, lab culture is tribal, middle management plays favorites and does not treat staff equally. Constant unaddressed rumors of layoffs lead to apathy and discourage innovation."
710,Pfizer,Healthcare,Principal scientist,2025-11-04,3.0,Learned a lot while was there how to do drug development properly,Red tape at every step
711,Pfizer,Healthcare,Director external quality,2025-11-03,4.0,"Work life balance
Good comp
Product base","Financial issues currently, downsizing and reorgs"
712,Pfizer,Healthcare,Sales,2025-10-29,4.0,Solid company Great opportunities. Lots of experienced people to learn from.,Very large. Get lost easy
713,Pfizer,Healthcare,Anonymous employee,2025-10-31,4.0,Good benefits and workplace culture,Too many layoffs and reorgs
714,Pfizer,Healthcare,Ehs specialist,2025-10-01,3.0,"Benefits, coworkers, facilities are being upgraded.","Salary below industry average, work-life balance, ability to facilitate change, facilities are old and at least a decade overdue for renovation, communication from management, employee morale."
715,Pfizer,Healthcare,Anonymous employee,2025-10-24,4.0,Smart coworkers and not crazy hours depending on the team,Very corporate hierarchy following and slow career growth
716,Pfizer,Healthcare,Documentation specialist,2025-10-20,3.0,Have great wellness program Generous PTO,expensive health insurance benefits (co-insurance)- covers nothing until you meet a high deductible
717,Pfizer,Healthcare,Marketing manager,2025-10-15,5.0,- Very human and flexible culture with very strong work life balance/no toxic hustle culture. - Pay is good - I like my coworkers,None to note so far.
718,Pfizer,Healthcare,Engagement partner,2025-10-20,3.0,Lots of great benefits and people,People have been there their whole career. It’s hard to bring new ideas.
719,Pfizer,Healthcare,Lead executive assistant,2025-09-18,1.0,None at this time. Terrible experience from day one.,"Unprofessional Lower wage/salary than most pharma Bonuses only to mgmt and above Extreme low morale and while leader is aware of it, they don’t care. Promotion are not based on knowledge or expertise but rather who you kiss up too. Layoffs are year round non stop. Poor culture throughout the organization. Employees have either been there 30 years or 1 year. No inbetween. And those that have been there 30 years hardly discussed their desire to be laid off"
720,Pfizer,Healthcare,Finance manager,2025-10-22,5.0,People and culture are the best here,There really isn’t much to say here
721,Pfizer,Healthcare,Lead executive assistant,2025-09-18,1.0,None at this time. Terrible experience from day one.,"Unprofessional Lower wage/salary than most pharma Bonuses only to mgmt and above Extreme low morale and while leader is aware of it, they don’t care. Promotion are not based on knowledge or expertise but rather who you kiss up too. Layoffs are year round non stop. Poor culture throughout the organization. Employees have either been there 30 years or 1 year. No inbetween. And those that have been there 30 years hardly discussed their desire to be laid off"
722,Pfizer,Healthcare,Finance manager,2025-10-22,5.0,People and culture are the best here,There really isn’t much to say here
723,Pfizer,Healthcare,Technical project manager,2025-09-25,3.0,Great colleagues to work with and large company with a vast range of opportunities to move around and learn different things,It's a corporate job where money and stock price drive all decisions regardless of all the culture and family first language within the company. Typical corporate politics move the needle in too many situations vs logic and results
724,Pfizer,Healthcare,Health and science specialist,2025-10-21,5.0,Great company - excellent benefits,No cons to report at the moment
725,Pfizer,Healthcare,Scientist,2025-10-20,3.0,Not too busy and laxed,Can get out of control
726,Pfizer,Healthcare,Anonymous employee,2025-10-14,4.0,"Nice people, great teams. Good WLB and people are generally helpful.",Things move a little slow there. Limited career growth.
727,Pfizer,Healthcare,Principal device engineer,2025-10-09,5.0,"Great culture, not cut through. Lots of CRGS, promote diversity. challenging work and good work/life balance.",Large companies = sometimes lots of rigid systems.
728,Pfizer,Healthcare,Aseptic filling technician,2025-09-30,2.0,The cafeteria food was serviceable and weekly pay was nice.,Managment is blatantly incompetent. Layoffs could happen at any point. Took away double time (Should've unionized when you had the chance. WHOOPS lol) Benefits are mediocre. No upward mobility. Company basically falls apart on the off shifts particularly 2nd
729,Pfizer,Healthcare,Director,2025-10-07,4.0,I had a great experience as it was very amazing. Everyone was really great. I love you so,I wish they were more able to take a risk
730,Pfizer,Healthcare,Scientist,2025-09-15,3.0,"Management was okay, lots of opportunities to try new things and learn, pay was decent","Overall state of the company is very erratic and there is no job security, lots of work to be done and the work is not balanced across teams, promotions are difficult to achieve due to the limitations of the department"
731,Pfizer,Healthcare,Anonymous employee,2025-10-07,3.0,Good people to work. You can gain knowledge from the seniors.,Don't think about the promotions.
732,Pfizer,Healthcare,Intern,2025-10-03,5.0,I had a lot of interesting projects.,It is difficult to get rehired as a full time employee after the internship.
733,Pfizer,Healthcare,Senior engineer,2025-10-05,4.0,Great people to work with.,"Corporate mentality, a lot of restructuring and changing timelines and deadlines."
734,Pfizer,Healthcare,Sales representative,2025-10-06,3.0,Freedom to control daily activity,Not competing salary and bonus
735,Pfizer,Healthcare,Senior leader,2025-04-06,1.0,"No pros, just a lot of cons, specially at this site. All older employees have their kids and family working in other departments. The number of politics at this facility is nonsensical and highly toxic due to legacy employees. Every SLT member has a son or daughter working in the company and by passing processes. doing nothing and minting money. Management is toxic within the plant and specially above site. They have layoffs every other year so everyone lives in fear. During my time there did not meet one single person who has any good thing to say about anything.","Perhaps they get the award for being the the most miserable vial work environment for all levels in the organization, High attrition rates and low pay are the hallmarks, new employees dont see their supervisors for weeks. The previous site head was a unprofessional coward and a racist leader. Created an enviroment of fear, favoritism, and nepotism, He was endorsed by his superiors so this is company culture. I dont think there are any good people there, majority are incompetent people who now have their children and family working here too."
736,Pfizer,Healthcare,Anonymous employee,2025-05-09,2.0,If you have a good manager it can be great. You can jump from role to role easily if they like you.,"- Pfizer’s acquisition of Seagen destroyed the great culture we had in Bothell. - Pfizer’s culture is a popularity contest, especially in the New York scene. They admit as much in department meetings. They'll keep bringing back people they laid off if they like them, despite incompetence or job qualifications. - I've never had a more toxic manager or experience than at Pfizer. If the manager doesn't like you or doesn't want to hear your ideas, the accepted culture is to quiet fire people until they leave. (So I left, rather than be treated like garbage.) - They want robots to follow orders, no creative or innovative ideas welcome. They hide their true intentions under a disguise of being collaborative. - toxic leadership is encouraged to be as such and defended by HR"
737,Pfizer,Healthcare,Operational excellence,2025-09-09,4.0,"Good benefits, decent pay, flexible hybrid work","Feel like only way to get moved up is to leave the company for a few years, then return for a huge pay bump. They'd often hire externally for higher roles instead of giving people much deserved promotions."
738,Pfizer,Healthcare,Associate research fellow,2025-09-29,4.0,"good team work, good benefit",Decision making. light speed. critical gap in talent
739,Pfizer,Healthcare,Associate scientist,2025-10-04,3.0,Good culture in hard times,Bad pay in comparison to industry
740,Pfizer,Healthcare,Sales representative,2025-10-01,4.0,Great benefits and small territory,Micromanaging from above. No insurance coverage.
741,Pfizer,Healthcare,Director,2025-10-02,3.0,Flexibility with work life balance,Leadership is leading from behind
742,Pfizer,Healthcare,Anonymous employee,2025-09-30,5.0,"Growth, Compensation, Work/life balance, lengthy parental leave, benefits",None that come to mind
743,Pfizer,Healthcare,Scientist,2025-09-30,2.0,Lots of tech and money to spend on reagents,CEO supports trump Future direction unclear constant lay-offs
744,Pfizer,Healthcare,Senior production operator ii,2025-06-27,4.0,"Great Benefits. Top-tier PTO with vacation, sick, caregiver, personal, and the ability to purchase additional vacation if needed. With maximum time purchased for vacation, time can equal 2-3 months of PTO per year.",Horrible work culture. Supervisors routinely have their hands tied on what they can do for their employees. Can be Chaotic with production taking priority over everything else. Questionable decisions made by management regarding Quality and GDP practices to keep production running. Constant threat of mandatory overtime. Pay is not consistent with other sites.
745,Pfizer,Healthcare,Network specialist,2025-09-28,5.0,"Good work relationships
Good training","Zero tolerance policy
Airgapped environment"
746,Pfizer,Healthcare,Sr data manager,2025-09-22,4.0,Good work life balance and reputation.,Can be easily lost in massive company especially with poor management.
747,Pfizer,Healthcare,"Director, clinical data management",2025-09-23,5.0,great place to work - go for it,not any to specify. here/
748,Pfizer,Healthcare,Quality operations manager,2025-09-26,4.0,Lateral and diagonal Career development opportunities,Salary vs cost of living
749,Pfizer,Healthcare,Medical affairs,2025-09-19,4.0,Extremely talented colleagues driven to do their best work supporting patients,Large and complex organization that can impede execution
750,Pfizer,Healthcare,Principal process engineer,2025-09-22,5.0,Culture is great at pfizer,Growing at an exponential rate
751,Pfizer,Healthcare,Automation engineer,2025-09-20,2.0,Pay and benefits were good,There was no formal training and you were just thrown into the fire
752,Pfizer,Healthcare,Anonymous employee,2025-09-03,1.0,"Good benefits, nice office amenities","Poor forecasting, many rounds of layoffs, stagnant salary, no room for upward growth"
753,Pfizer,Healthcare,Programmer/analyst,2025-09-14,5.0,supportive and a growth culture,I hardly found one as is platform with peer contributions and work support.
754,Pfizer,Healthcare,Global leader,2025-09-17,5.0,- Great pay and learning opportunities,- Can be bureactratic at times
755,Pfizer,Healthcare,Anonymous employee,2025-08-30,4.0,A lot of cross functional collaboration. You can approach anybody without having been introduced and ask about their job/work. There's opportunity to shadow other groups formally or informally,Work hours can be long
756,Pfizer,Healthcare,Senior process technician,2025-08-18,3.0,They have a really good benefits package.,"Progression is stagnant, and performance doesn't trump tenure. So you must be ok with your typical rubber stamp increase. Mid year increases are RARE."
757,Pfizer,Healthcare,Engineer,2025-09-05,4.0,-Flexible scheduling for salaried colleagues with hybrid option,-Many growth opportunities are given to folks who have been on the site longer
758,Pfizer,Healthcare,Anonymous employee,2025-08-08,4.0,Salary and benefits were good and a good manager can make or break you anywhere.,Survived many many layoffs throughout the company which leads to overall anxiety in the various groups I worked in. A new acquisition was equated with a new series of layoffs. Saw many very good employees with a wealth of experience let go.
759,Pfizer,Healthcare,Anonymous employee,2025-09-01,3.0,"Solid benefits package, huge amount of resources to draw from, opportunities for growth","Regular layoffs, rigid promotion structure, salary is on lower end of industry average"
760,Pfizer,Healthcare,Engineer,2025-08-20,4.0,"Lots of growth opportunities, great atmosphere, caring leadership, great culture, dynamic work, no 2 days the same, contribution to better health is high",High workload with no end
761,Pfizer,Healthcare,Engineer,2025-08-20,4.0,"Lots of growth opportunities, great atmosphere, caring leadership, great culture, dynamic work, no 2 days the same, contribution to better health is high",High workload with no end
762,Pfizer,Healthcare,Anonymous employee,2025-09-10,5.0,"Great people, benefits, environment, good salary",Constant reorganization and budget cutting
763,Pfizer,Healthcare,Sr. scientist,2025-09-03,4.0,Lots of resources and access to new technologies,A bit slow with decisions making process
764,Pfizer,Healthcare,Senior process technician,2025-07-16,5.0,Benifits and Pay are much better than most of the competitors i know of. Workload can be hectic at times but this is the happiest ive been at a job at a long time. Most of team has been here 20+ years which is a great sign,within biotech there can be layoff scares also seems like manufacturing is always getting the brunt of things and office / m-f workers get all the perks
765,Pfizer,Healthcare,Scientist,2025-08-31,4.0,"Great benefits, great healthcare, generous PTO, Flexible work schedule, good work-life balance.","Shifting priorities, relatively slow career growth"
766,Pfizer,Healthcare,Marketing director,2025-09-03,3.0,"Autonomy
Great work life balance","Frequent layoffs
Limited opportunities to advance"
767,Pfizer,Healthcare,Data analyst,2025-09-03,3.0,work from home hybrid desk,low pay work and benefits
768,Pfizer,Healthcare,Senior manager data analyst,2025-08-25,4.0,hybrid work week and a nice team,initial training was lacking on most jobs
769,Pfizer,Healthcare,Senior level,2025-04-29,2.0,"Big company’s benefits, infrastructure, nice campus and facilities","Key focus areas include financial gain and short-term objectives, with a lack of emphasis on long-term strategies and insufficient expertise in discovery and development. The business model relies heavily on licensing agreements. Consequently, the organization undergoes frequent reorganizations and layoffs, and struggles with competency gaps. Management appointments are often influenced by personal connections rather than merit. Ineffective people management, limited experience, and a lack of management training programs and growth opportunities are also evident. Moreover, favoritism and discrimination against non-Asian nationalities are significant concerns."
770,Pfizer,Healthcare,Full stack java developer,2025-07-29,4.0,"Purpose-driven work in healthcare tech. Supportive Agile team with clear processes. Tech stack included Spring Boot, React, JWT, Azure, and Docker. Good exposure to CI/CD, BDD, and cross-functional collaboration.",Slightly slow in adopting new tech due to compliance. Some delays in approvals and release cycles.
771,Pfizer,Healthcare,Manager,2025-08-03,3.0,"Big company, good flexibility, nice buildings.","Bad leadership, so many disparities amongst colleague's benefits."
772,Pfizer,Healthcare,Principal scientist,2025-08-11,4.0,"Inspiring mission, effective leaders, good compensation and benefits, rigorous science","Moderate staff turnover, occasional organisational changes, large company"
773,Pfizer,Healthcare,Supply chain and sustainability analyst,2025-08-14,4.0,"Flexible, good compensation, good TC, great people.",Hard to move up in the system.
774,Pfizer,Healthcare,Director,2025-08-10,4.0,"Very nice people, great retirement savings package.",Too many re-orgs and layoffs every Q4.
775,Pfizer,Healthcare,Complaints handler,2025-08-11,3.0,Good pay for the organization,Engineer hired just to read records and not develop solutions
776,Pfizer,Healthcare,Scientist,2025-08-11,3.0,"the perks, benefits and salary","Hierarchy, layoffs, layoffs, layoffs, cuts"
777,Pfizer,Healthcare,Senior scientist,2025-07-28,4.0,"benefits, pay, interesting problems, brand recognition, lots of smart people here","typical issues with large corporations -- projects can get cut very regularly, frequent layoffs"
778,Pfizer,Healthcare,Senior regulartory associate,2025-08-03,4.0,"Flexible, not stressful, great benefits.","Layoffs every 2 years, not much room for advancement"
779,Pfizer,Healthcare,Pharmaceutical technician,2025-07-02,4.0,"Plenty of overtime hours, if you want them","Lots of people are there to retire, making it hard to move up and get into certain positions"
780,Pfizer,Healthcare,Senior production equipment operator/trainer,2025-07-14,4.0,Generous benefits like pto. Depending on years of service determined how much time you’re eligible for. Great medical and dental benefits.,Constant lay-offs. Poor management decisions. Company decisions did not make a lot of sense at times.
781,Pfizer,Healthcare,Sr accountant,2025-07-30,5.0,"Pfizer is great, pay is decent and organization does many events for employees",Cannot think of any at this time.
782,Pfizer,Healthcare,Senior scientist,2025-07-27,3.0,Great collaboration between people in the lab,To many leaders but no clear direction. They don’t care about your growth and development
783,Pfizer,Healthcare,Immunology specialist,2025-07-18,4.0,Fair - bonus is good when doing well,Can be micromanaged too much
784,Pfizer,Healthcare,Senior manager,2025-07-30,4.0,"Good benefits, supportive team, stock benefits","Layoffs every year for past 2-3 years, corporate red tape"
785,Pfizer,Healthcare,Statistical programmer,2025-06-13,4.0,"Company offers great benefits and a flexible work schedule. there are also plenty of opportunities to continue learning and growing professionally, especially through team collaboration and internal trainings","Due to the size and structure of the organization, processes can be slow and bureaucratic. Even simple tasks may require multiple tickets and approvals, which can be time-consuming and sometimes frustrating. Can be stressful to meet tight timeline."
786,Pfizer,Healthcare,Product manager,2025-07-30,4.0,Smart coworkers who are passionate about what they do,Constant reorgs and prioritization exercises
787,Pfizer,Healthcare,Anonymous employee,2025-04-18,2.0,"Pros include salary, work-life-balance, great name to have on your resume. However, these golden handcuffs come with a cost.","During my time at Pfizer, I witnessed a troubling pattern. Within a few years, I saw multiple talented, kind, emotionally intelligent people either quit, get laid off, or be pushed out. There is no space for kindness—just performance, politics, and staying silent to survive. If you're a highly sensitive or caring person, this may not be a safe environment for you. Rather than being supported, your vulnerability will be seen as weakness. Unfortunately, bad behavior is rewarded as with many large corporate environements."
788,Pfizer,Healthcare,Senior manager,2025-06-26,1.0,Not the best decent salary and benefits. Job is fun and rewarding.,"Extremely poor leadership and management. Only promoted if you are liked and kiss (you know). Work life-balance is only talked about. Even when you go above and beyond, you are not recognized unless you are the chosen ones."
789,Pfizer,Healthcare,Scientist,2025-07-29,4.0,Good work life benefit and people care,"Stability is difficult in pharma, uncertainy"
790,Pfizer,Healthcare,Principal scientist,2025-02-24,3.0,"Very smart colleagues, rigorous atmosphere, decent access to resources, no more red tape than your average mega-corp.","Lots of layoffs, all the time. It becomes very difficult to avoid cynicism when all the happy-talk from Bourla on down about how valued you are, how vital your mission, how very life-changing to patients it all is when counterbalanced by the experience of rolling layoffs and abandonment of entire therapeutic areas. If you're fortunate, you can last a long time and make a good living. But make no mistake: Your number may come up a lot sooner than you anticipate, and when it does, it's all cold, hard business. Don't get attached, and keep your resume fresh."
791,Pfizer,Healthcare,Senior finance manager,2025-07-30,5.0,Professional and a great learning experience.,Moved dept out of state
792,Pfizer,Healthcare,Anonymous employee,2025-07-22,4.0,Great colleagues and opportunities. Care very much about the work they provide.,No thoughts come to my mind.
793,Pfizer,Healthcare,Senior associate quality assurance,2025-07-28,3.0,Many Projects/Good People/Winter Holiday Shutdown,Disorganized/Bad Health Insurance/Low Time Off
794,Pfizer,Healthcare,Senior scientist,2025-06-10,4.0,"Great people, fair compensation in addition to salary (bonus, restricted stock, etc. Great opportunities for growth into other areas.","Ever-changing business and research model, making it challenging for employees to get their legs under them to do their jobs. Some very poor decisions from corporate. Bourla was/is especially bad"
795,Pfizer,Healthcare,Anonymous employee,2025-07-21,5.0,great place to work to make vaccines,Not that I know of
796,Pfizer,Healthcare,Scientist,2025-06-15,4.0,"Gold standard of training, exposure to different projects and groups, many opportunities to attain visibility, most managers are super friendly and understanding, great work life balance","Lots of red tape, promotions can be a little slow sometimes, lots of reorgs/layoffs as of recently"
797,Pfizer,Healthcare,Director,2025-06-20,3.0,Good pay and benefits. Great personnel in the Bothell facility. Always helpful.,Unknown direction with Pfizer takeover. Meshing of two very different cultures.
798,Pfizer,Healthcare,Manager,2025-06-11,3.0,"Positive culture, opportunities to move within the company from one functional area to another, nice office in NYC, hybrid work schedule. Good work life balance","Few promotion opportunities, Salaries are not competitive with the industry, Pfizer is very cliquey. Lots of re-org going on the last few years within Pfizer R&D"
799,Pfizer,Healthcare,Principal scientist,2025-07-18,4.0,"flexible work hours, good benefits",high pressure. light speed timeline
800,Pfizer,Healthcare,Compliance director,2025-05-30,3.0,Treats employees fairly including those who are severed.,Not innovative in terms of creative destruction and reinvention of business process.
801,Johnson & Johnson,Healthcare,Team member,2025-11-12,5.0,Good pay and friendly family like environment,None from my personal experience
